"","country_names","country_urls","text"
Singaporean residents also travel by e-scooters[299], bicycles, bus, taxis and train (MRT or LRT). Two companies run the train transport system—SBS Transit and SMRT Corporation. Four companies, Go-Ahead, Tower-Transit, SBS Transit and SMRT Corporation run the public buses under a 'Bus Contracting Model' where operators bid for routes. There are six taxi companies, who together put out over 28,000 taxis on the road.[300] Taxis are a popular form of public transport as the fares are relatively cheap compared to many other developed countries.[301]

Singapore is a major international transport hub in Asia, serving some of the busiest sea and air trade routes. Changi Airport is an aviation centre for Southeast Asia and a stopover on the Kangaroo Route between Sydney and London.[302] There are eight airports around Singapore, but besides Changi Airport, the other seven are not open to the public - Seletar Airport, Kallang Airport, Paya Lebar Air Base, Tengah Air Base, Sembawang Air Base, Changi Air Base and Changi Air Base (East). Singapore Changi Airport hosts a network of over 100 airlines connecting Singapore to some 300 cities in about 70 countries and territories worldwide.[303] It has been rated one of the best international airports by international travel magazines, including being rated as the world's best airport for the first time in 2006 by Skytrax.[304] The national airline is Singapore Airlines.[305]

The Port of Singapore, managed by port operators PSA International and Jurong Port, was the world's second-busiest port in 2005 in terms of shipping tonnage handled, at 1.15 billion gross tons, and in terms of containerised traffic, at 23.2 million twenty-foot equivalent units (TEUs). It is also the world's second-busiest, behind Shanghai, in terms of cargo tonnage with 423 million tons handled. In addition, the port is the world's busiest for transshipment traffic and the world's biggest ship refuelling centre.[306]

Access to water is universal, affordable, efficient and of high quality. Singapore relies on four main water sources, or ""four national taps"" -  water imported from neighbouring Malaysia, urban rainwater catchments, reclaimed water (NEWater) and seawater desalination. [307] Singapore's approach does not rely only on physical infrastructure, but it also emphasises proper legislation and enforcement, water pricing, public education as well as research and development.[308]

Singapore has declared that it will be water self-sufficient by the time its 1961 long-term water supply agreement with Malaysia expires in 2061. According to analysis by the Institute of Southeast Asian Studies in 2003,Singapore would already be water self-sufficient by 2011 and ""the 'water threat' is less than what it seems to be"".[309] However, according to official forecasts water demand in Singapore is expected to double from 380 to 760 million gallons per day between 2010 and 2060. The increase is expected to come primarily from non-domestic water use, which accounted for 55% of water demand in 2010 and is expected to account for 70% of demand in 2060. By that time water demand is expected to be met by reclaimed water at the tune of 50% and by desalination accounting for 30%, compared to only 20% supplied by internal catchments.[310][311]

Due to the need to invest in and upgrade the water system to address concerns such as climate change and increasing costs of producing water and maintaining water infrastructure, water prices in Singapore has been revised since 2017,[312] its first revision since 2000. The prices will generally increase by 30% over two phases from 1 July 2017, with 75% of households will see an increase of less than $18 in their monthly water bills. To help households manage the higher water prices, the Government will provide eligible HDB households with additional U-Save rebates, ranging from $40 to $120 per annum  depending on the type of the HDB flat.[313]

As of mid-2018, the estimated population of Singapore was 5,638,700 people, 3,471,900 (61.6%) of whom were citizens, while the remaining 2,166,800 (38.4%) were permanent residents (522,300) or foreign students/foreign workers/dependants (1,644,500).[4] According to the country's most recent census in 2010, nearly 23% of Singaporean residents (i.e. citizens and permanent residents) were foreign born (which means about 10% of Singapore citizens were foreign-born naturalised citizens); if non-residents were counted, nearly 43% of the total population were foreign born.[314][315]

The same census also reports that about 74.1% of residents were of Chinese descent, 13.4% of Malay descent, 9.2% of Indian descent, and 3.3% of other (including Eurasian) descent.[314] Prior to 2010, each person could register as a member of only one race, by default that of his or her father, therefore mixed-race persons were solely grouped under their father's race in government censuses. From 2010 onward, people may register using a multi-racial classification, in which they may choose one primary race and one secondary race, but no more than two.[316]

90.3% of resident households (i.e. households headed by a Singapore citizen or permanent resident) own the homes they live in, and the average household size is 3.43 persons (which include dependants who are neither citizens nor permanent residents).[317] However, due to scarcity of land, 80.4% of resident households live in subsidised, high-rise, public housing apartments known as ""HDB flats"" because of the government board (Housing and Development Board) responsible for public housing in the country. Also, 75.9% of resident households live in properties that are equal to, or larger than, a four-room (i.e. three bedrooms plus one living room) HDB flat or in private housing.[317][318] Live-in foreign domestic workers are quite common in Singapore, with about 224,500 foreign domestic workers there, as of December 2013.[319]

The median age of Singaporean residents was 40.5 in 2017,[320] and the total fertility rate is estimated to be 0.80 children per woman in 2014, the lowest in the world and well below the 2.1 needed to replace the population.[321] To overcome this problem, the Singapore government has been encouraging foreigners to immigrate to Singapore for the past few decades. The large number of immigrants has kept Singapore's population from declining.[322]

All male citizens and permanent residents in Singapore have a statutory requirement to undergo a period of compulsory service in the uniformed services, known as National Service (or NS for short), as well as periodic reservist duties after completion of active duty. 


Buddhism is the most widely practised religion in Singapore, with 33% of the resident population declaring themselves adherents at the most recent census. The next-most practised religion is Christianity, followed by Islam, Taoism, and Hinduism. 17% of the population did not have a religious affiliation. The proportion of Christians, Taoists, and non-religious people increased between 2000 and 2010 by about 3 percentage points each, whilst the proportion of Buddhists decreased. Other faiths remained largely stable in their share of the population.[323] An analysis by the Pew Research Center found Singapore to be the world's most religiously diverse nation.[324][325] Singapore is a conservative society.[326]

There are monasteries and Dharma centres from all three major traditions of Buddhism in Singapore: Theravada, Mahayana, and Vajrayana. Most Buddhists in Singapore are Chinese and are of the Mahayana tradition,[327] with missionaries having come into the country from China for several decades. However, Thailand's Theravada Buddhism has seen growing popularity among the populace (not only the Chinese) during the past decade. The religion of Soka Gakkai International, a Japanese Buddhist organisation, is practised by many people in Singapore, but mostly by those of Chinese descent. Tibetan Buddhism has also made slow inroads into the country in recent years.[328]

Sultan Mosque, a historic mosque in Kampong Glam


Saint Andrew's Cathedral in the Civic District has existed since 1836.


The Buddha Tooth Relic Temple and Museum in the heart of Chinatown


Armenian Apostolic Church in Singapore


Singapore has four official languages: English, Malay, Mandarin Chinese, and Tamil.[329] English is the common language, and is the language of business and government, and the medium of instruction in schools.[330][331]Public bodies in Singapore, such as the Singapore Public Service, (which includes the Singapore Civil Service and other agencies),[332] conduct their business in English, and official documents written in a non-English official language such as Malay, Chinese or Tamil typically have to be translated into English to be accepted for submission.[citation needed]

The Constitution of Singapore and all laws are written in English,[333] and interpreters are required if one wishes to address the Singaporean Courts in a language other than English.[334] English is the native tongue for only one-third of all Singaporeans, with roughly a quarter of all Singaporean Malays, a third of all Singaporean Chinese, and half of all Singaporean Indians speaking it as their native tongue. Twenty percent of Singaporeans cannot read or write in English.[323][335]

Singaporeans are mostly bilingual, with English as their common language and usually the mother-tongue as a second language taught in schools, in order to preserve each individual's ethnic identity and values. The official languages amongst Singaporeans are English (80% literacy), Mandarin (65% literacy), Malay (17% literacy), and Tamil (4% literacy).[323][336]Singapore English is based on British English,[337] and forms of English spoken in Singapore range from Standard Singapore English to a colloquial form known as ""Singlish"". Singlish is discouraged by the government.[338]

English is the language spoken by most Singaporeans at home, 36.9% of the population, just ahead of Mandarin.[339][341] Nearly half a million speak other varieties of Chinese, mainly Hokkien, Teochew, and Cantonese, as their home language, although the use of these is declining in favour of Mandarin and English.[342]Singapore Chinese characters are written using simplified Chinese characters.[343]

Malay was chosen as a national language by the Singaporean government after independence from Britain in the 1960s to avoid friction with Singapore's Malay-speaking neighbours Malaysia and Indonesia.[344] It has a symbolic, rather than functional purpose.[329][345][346] It is used in the national anthem ""Majulah Singapura"",[347] in citations of Singaporean orders and decorations, and in military commands. In general, Malay is spoken mainly within the Singaporean Malay community, with only 17% of all Singaporeans literate in
it[348] and only 12% using it as their native language.[339] While Singaporean Malay is officially written in the Latin-based Rumi script, some Singaporean Malays still learn the Arabic-based Jawi script as children alongside Rumi,[349] and Jawi is considered an ethnic script for use on Singaporean Identity Cards.[350]

Around 100,000 Singaporeans, or 3% of the population, speak Tamil as their native language.[339] Tamil has official status in Singapore and there have been no attempts to discourage the use of other Indian languages.[351]

The education system in Singapore has been noted to be one of the best in the world. Singapore students excelled in most of the world education benchmarks in maths, science and reading. In 2015, both its primary and secondary students rank first in OECD's global school performance rankings across 76 countries—described as the most comprehensive map of education standards.[352][353] In 2016, Singapore students topped both the Program International Student Assessment (PISA)[354][355][356][357] and the Trends in International Mathematics and Science Study (TIMSS).[358][359][360]

In the 2015 International Baccalaureate exams taken in 107 countries, Singapore students fared best with more than half of the world's 81 perfect scorers and 98% passing rate.[361] In the 2016 EF English Proficiency Index taken in 72 countries, Singapore place 6th and has been the only Asian country in the top ten.[362][363][364][365]
Singapore literature students have won the Angus Ross Prize by Cambridge Examinations every year since 1987 (except in 2000), awarded to the top A-level English literature student outside Britain, with about 12,000 international candidates.[366][367]

Education for primary, secondary, and tertiary levels is mostly supported by the state. All institutions, private and public, must be registered with the Ministry of Education.[368] English is the language of instruction in all public schools,[369] and all subjects are taught and examined in English except for the ""mother tongue"" language paper.[370] While the term ""mother tongue"" in general refers to the first language internationally, in Singapore's education system, it is used to refer to the second language, as English is the first language.[371][372] Students who have been abroad for a while, or who struggle with their ""Mother Tongue"" language, are allowed to take a simpler syllabus or drop the subject.[373][374]

Education takes place in three stages: primary, secondary, and pre-university education. Only the primary level is compulsory. Students begin with six years of primary school, which is made up of a four-year foundation course and a two-year orientation stage. The curriculum is focused on the development of English, the mother tongue, mathematics, and science.[375][376] Secondary school lasts from four to five years, and is divided between Special, Express, Normal (Academic), and Normal (Technical) streams in each school, depending on a student's ability level.[377] The basic coursework breakdown is the same as in the primary level, although classes are much more specialised.[378] Pre-university education takes place over two to three years at senior schools, mostly called Junior Colleges.[379] As alternatives to Pre-U education, however, courses are offered in other post-secondary education institutions, including 5 polytechnics and the institutes of technical education (ITEs). Singapore has six public universities[380] of which the National University of Singapore and Nanyang Technological University are among the top 20 universities in the world.[381]

National examinations are standardised across all schools, with a test taken after each stage. After the first six years of education, students take the Primary School Leaving Examination (PSLE),[375] which determines their placement at secondary school. At the end of the secondary stage, GCE ""O""-Level or ""N""-level exams are taken;[382] at the end of the following pre-university stage, the GCE ""A""-Level exams are taken.[383] Some schools have a degree of freedom in their curriculum and are known as autonomous schools, for secondary education level and above.[377]

Singapore has a generally efficient healthcare system, even though health expenditures are relatively low for developed countries.[384] The World Health Organisation ranks Singapore's healthcare system as 6th overall in the world in its World Health Report.[385] In general, Singapore has had the lowest infant mortality rate in the world for the past two decades.[386] Life expectancy in Singapore is 80 for males and 85 for females, placing the country 4th in the world for life expectancy, as almost the whole population has access to improved water and sanitation facilities. 


As of December 2011 and January 2013, 8,800 foreigners and 5,400 Singaporeans were respectively diagnosed with HIV, [387] but there are fewer than 10 annual deaths from HIV per 100,000 people. There is a high level of immunisation.[citation needed] Adult obesity is below 10%.[388] The Economist Intelligence Unit, in its 2013 ""Where-to-be-born Index"", ranked Singapore as having the best quality of life in Asia and sixth overall in the world.[389]

The government's healthcare system is based upon the ""3M"" framework. This has three components: Medifund, which provides a safety net for those not able to otherwise afford healthcare, Medisave, a compulsory national medical savings account system covering about 85% of the population, and Medishield, a government-funded health insurance program. Public hospitals in Singapore have a considerable autonomy in their management decisions, and notionally compete for patients, however they remain in government ownership and government appoints their boards and Chief Executive Officers and management reports and is responsible to these boards.[390] A subsidy scheme exists for those on low income.[391] In 2008, 32% of healthcare was funded by the government. It accounts for approximately 3.5% of Singapore's GDP.[392]

Despite its small size, Singapore has a diversity of languages, religions, and cultures.[393] Former Prime Ministers of Singapore, Lee Kuan Yew and Goh Chok Tong, have stated that Singapore does not fit the traditional description of a nation, calling it a society-in-transition, pointing out the fact that Singaporeans do not all speak the same language, share the same religion, or have the same customs.[393][394] Even though English is the first language of the nation, according to the 2010 census, 20% of Singaporeans are illiterate in English. This is however an improvement from 1990, when 40% of Singaporeans were illiterate in English.[395][396]

From 1819, it served as a trading port for British ships on their way to India. Being a major trading hub and its close proximity to its neighbour Malaysia, Singapore was prone to many foreign influences, both from Britain and from other Asian countries. Chinese and Indian workers moved to Singapore to work at the harbour. The country remained a British colony until 1942.[397]

When Singapore became independent from the United Kingdom in 1963, most Singaporean citizens were uneducated labourers from Malaysia, China and India.[citation needed] Many were transient labourers, seeking to make some money in Singapore, with no intention of staying permanently.[398] There was also a sizeable minority of middle-class, locally born people—known as Peranakans or Baba-Nyonya—descendants of 15th- and 16th-century Chinese immigrants. With the exception of the Peranakans who pledged their loyalties to Singapore, most of the labourers' loyalties lay with their respective homelands of Malaysia, China and India. After independence, the government began a deliberate process of crafting a Singaporean identity and culture.[398]

Each Singaporean's behaviours and attitudes are influenced by, among other things, his or her home language and his religion. Singaporeans who speak English as their native language tend to lean toward Western culture, while those who speak Chinese as their native language tend to lean toward Chinese culture and Confucianism. Malay-speaking Singaporeans tend to lean toward Malay culture, which itself is closely linked to Islamic culture.[399][400]

Racial and religious harmony is regarded by Singaporeans as a crucial part of Singapore's success, and played a part in building a Singaporean identity.[401][402]

The national flower of Singapore is the hybrid orchid, Vanda 'Miss Joaquim', named in memory of a Singapore-born Armenian woman, who crossbred the flower in her garden at Tanjong Pagar in 1893.[403] Many national symbols such as the Coat of arms of Singapore and the Lion head symbol of Singapore make use of the lion, as Singapore is known as the Lion City. Major religious festivals are public holidays.[404]

Singapore has a reputation as a nanny state.[405][406] The government also places heavy emphasis on meritocracy, where one is judged based on one's ability.[407]

Since the 1990s when the National Arts Council was created to spearhead the development of performing arts, visual and literary art forms, to hasten a vibrant cosmopolitan ""gateway between the East and West"".[408]

The National Gallery Singapore is the nation's flagship museum with some 8,000 works of Singapore and South East Asian artists. The Singapore Art Museum focuses on contemporary art. The Red Dot Design Museum celebrates exceptional art and design of objects for everyday life, from more than 1,000 items from 50 countries. The lotus-shaped ArtScience Museum host touring exhibitions that combine art with the sciences. Other major museums include the Asian Civilisations Museum, Peranakan Museum, The Arts House.[409]

The Esplanade is Singapore's largest performing arts centre with many performances throughout the year, including 5,900 free arts and culture events in 2016.[410][411] Some of the major music and dance groups include the Singapore Symphony Orchestra, Singapore Chinese Orchestra, Singapore Dance Theatre


Literature of Singapore, or SingLit, comprises a collection of literary works by Singaporeans written chiefly in the country's four official languages: English, Malay, Standard Mandarin and Tamil. It is increasingly regarded as having four sub-literatures instead of one. Many significant works has been translated and showcased in publications such as the literary journal Singa, published in the 1980s and 1990s with editors including Edwin Thumboo and Koh Buck Song, as well as in multilingual anthologies such as Rhythms: A Singaporean Millennial Anthology Of Poetry (2000), in which the poems were all translated three times each into the three languages. A number of Singaporean writers such as Tan Swie Hian and Kuo Pao Kun have contributed work in more than one language, although such cross-linguistic fertilisation is becoming increasingly rare.[citation needed]

Singapore has a diverse music culture that ranges from pop and rock, to folk and classical. Western classical music plays a significant role in the cultural life in Singapore, with the Singapore Symphony Orchestra (SSO) instituted in 1979. Other notable western orchestras in Singapore include Singapore National Youth Orchestra which is funded by the Ministry of Education[412] and the community-based Braddell Heights Symphony Orchestra[413]. Many orchestras and ensembles are also found in secondary schools and junior colleges. Various communities have their own distinct ethnic musical traditions: Chinese, Malays, Indians, and Eurasians. With their traditional forms of music and various modern musical styles, the fusion of different forms account for the musical diversity in the country.[414] The nation's lively urban musical scene has made it a centre for international performances and festivals in the region. Some of Singapore's best known pop singers includes Stefanie Sun,[415]JJ Lin, Liang Wern Fook, Taufik Batisah and Dick Lee, who is famous for composing National Day theme songs, including Home.[416]

Dining is said to be Singaporeans' national pastime,[417] and even an obsession for many.[411] Singapore's diversity of cuisine is touted as a reason to visit the country, one of the best locations when it comes to a combination of convenience, variety, quality and price.[418]Hainanese chicken rice (海南鸡饭; Hǎinán jī fàn), based on the Hainanese dish Wenchang chicken, is considered Singapore's national dish.[419][420]

The city-state has a burgeoning food scene ranging from hawker centres (open-air), food courts (air-conditioned), coffee shops (open-air with up to a dozen hawker stalls), cafes, fast food, simple kitchens, casual, celebrity and high-end restaurants.[421] Every day, two new restaurants open in Singapore.[422] Many international celebrity chef restaurants are located within the integrated resorts.[423] Religious dietary strictures exist – Muslims do not eat pork and Hindus do not eat beef, and there is also a significant group of vegetarians. For most events, organisers will be mindful of them and cater food that is acceptable to all or provide choices for the ethnic minorities. The Singapore Food Festival which celebrates Singapore's cuisine is held in July annually.


Prior to the 1980s, street food were mainly sold by immigrants from China, India and Malaysia to other immigrants seeking a familiar taste. In Singapore, street food has long migrated into hawker centres with communal seating areas. Typically, these centres have a few dozen to hundreds of food stalls, with each specialising in a single or a number of related dishes. The choices are almost overwhelming even for locals.[424][421] Although cooked food that originates from or still sold on streets can be found in many countries, the variety and reach of centralised hawker centres that serve heritage street food in Singapore is unmatched elsewhere.[425]

In 2018, there are 114 hawker centres spread across the city centre and heartland housing estates. They are maintained by the National Environment Agency, which also grade each food stall for hygiene. The largest hawker centre is located on the second floor of Chinatown Complex with over 200 stalls.[425] The complex is also home to the cheapest Michelin-starred meal in the world – a plate of soya-sauce chicken rice or noodles for S$2 (US$1.50). Two street food stalls in the city are the first in the world to be awarded a Michelin star each.[426]

