"","country_names","country_urls","text"
Mohinga is the traditional breakfast dish and is Myanmar's national dish. Seafood is a common ingredient in coastal cities such as Sittwe, Kyaukpyu, Mawlamyaing (formerly Moulmein), Mergui (Myeik) and Dawei, while meat and poultry are more commonly used in landlocked cities like Mandalay. Freshwater fish and shrimp have been incorporated into inland cooking as a primary source of protein and are used in a variety of ways, fresh, salted whole or filleted, salted and dried, made into a salty paste, or fermented sour and pressed.


Burmese cuisine also includes a variety of salads (a thoke), centred on one major ingredient, ranging from starches like rice, wheat and rice noodles, glass noodles and vermicelli, to potato, ginger, tomato, kaffir lime, long bean, lahpet (pickled tea leaves), and ngapi (fish paste).


The Lethwei, Bando, Banshay, and Pongyi thaing martial arts and chinlone are traditional sports in Myanmar.[352] Football is played all over the country, even in villages.


The 2013 Southeast Asian Games took place in Naypyidaw, Yangon, Mandalay and Ngwesaung Beach in December representing the third occasion that the event has been staged in Myanmar. Myanmar previously hosted the Games in 1961 and 1969.[353]

Burmese traditional art concepts is popular and respected by the Burmese people and people from abroad.


Burmese contemporary art has developed quite rapidly on its own terms. Artists born after the 1980s have had greater chances of art practice outside the country.


One of the first to study western art was Ba Nyan. Together with Ngwe Gaing and a handful of other artists, they were the pioneers of western painting style. Later on most young children learned the concepts from them. Some well known contemporary artists are Lun Gywe, Aung Kyaw Htet, MPP Yei Myint, Myint Swe, Min Wai Aung, Aung Myint, Kin Maung Yin, Po Po and Zaw Zaw Aung.


Due to Myanmar's political climate, there are not many media companies in relation to the country's population, although a certain number exists. Some are privately owned. All programming must meet with the approval of the censorship board.


The Burmese government announced on 20 August 2012 that it will stop censoring media before publication. Following the announcement, newspapers and other outlets no longer required approved by state censors; however, journalists in the country can still face consequences for what they write and say.[354]

In April 2013, international media reports were published to relay the enactment of the media liberalisation reforms that we announced in August 2012. For the first time in numerous decades, the publication of privately owned newspapers commenced in the country.[355]

Internet use is estimated to be relatively low compared to other countries.[356] Myanmar's internet used to be subject to censorship, and authorities viewed e-mails and posts on Internet blogs until 2012 when the government removed media censorship. During the strict censorship days, activity at internet cafes was regulated, and one blogger named Zarganar was sentenced to prison for publishing a video of destruction caused by Cyclone Nargis in 2008; Zarganar was released in October 2011.


In regards to communications infrastructure, Myanmar is the last ranked Asian country in the World Economic Forum's Network Readiness Index (NRI) – an indicator for determining the development level of a country's information and communication technologies. With 148 countries reported on, Myanmar ranked number 146 overall in the 2014 NRI ranking.[357] No data is currently available for previous years.


Myanmar's first film was a documentary of the funeral of Tun Shein—a leading politician of the 1910s, who campaigned for Burmese independence in London. The first Burmese silent film Myitta Ne Thuya (Love and Liquor) in 1920 which proved a major success, despite its poor quality due to a fixed camera position and inadequate film accessories. During the 1920s and 1930s, many Burmese-owned film companies made and produced several films. The first Burmese sound film was produced in 1932 in Bombay, India with the title Ngwe Pay Lo Ma Ya (Money Can't Buy It). After World War II, Burmese cinema continued to address political themes. Many of the films produced in the early Cold War era had a strong propaganda element to them.


In the era that followed the political events of 1988, the film industry has been increasingly controlled by the government. Film stars who had been involved in the political activities were banned from appearing in films. The government issues strict rules on censorship and largely determines who produces films, as well as who gets academy awards.[358]

Over the years, the movie industry has also shifted to producing many lower budget direct-to-video films.


Most of the movies produced nowadays are comedies.[359] In 2008, only 12 films worthy of being considered for an Academy Award were made, although at least 800 VCDs were produced.[360]

Myanmar is the primary subject of a 2007 graphic novel titled Chroniques Birmanes by Québécois author and animator, Guy Delisle. The graphic novel was translated into English under the title Burma Chronicles in 2008. In 2009, a documentary about Burmese videojournalists called Burma VJ was released.[361] This film was nominated for Best Documentary Feature at the 2010 Academy Awards.[362]The Lady had its world premiere on 12 September 2011 at the 36th Toronto International Film Festival.[363]

Government


General information


Economy


Agriculture


Trade


Environment


Coordinates: 22°N 96°E﻿ / ﻿22°N 96°E﻿ / 22; 96
"
"7","Philippines","https://en.wikipedia.org/wiki/Philippines","


Coordinates: 13°N 122°E﻿ / ﻿13°N 122°E﻿ / 13; 122






The Philippines (/ˈfɪləpiːnz/ (listen) FIL-ə-peenz; Filipino: Pilipinas [ˌpɪlɪˈpinɐs] or Filipinas [ˌfɪlɪˈpinɐs]), officially the Republic of the Philippines (Filipino: Republika ng Pilipinas),[a] is an archipelagic country in Southeast Asia. Situated in the western Pacific Ocean, it consists of about 7,641 islands[19] that are categorized broadly under three main geographical divisions from north to south: Luzon, Visayas, and Mindanao. The capital city of the Philippines is Manila and the most populous city is Quezon City, both part of Metro Manila.[20] Bounded by the South China Sea on the west, the Philippine Sea on the east and the Celebes Sea on the southwest, the Philippines shares maritime borders with Taiwan to the north, Vietnam to the west, Palau to the east, and Malaysia and Indonesia to the south.


The Philippines' location on the Pacific Ring of Fire and close to the equator makes the Philippines prone to earthquakes and typhoons, but also endows it with abundant natural resources and some of the world's greatest biodiversity. The Philippines has an area of 300,000 km2 (120,000 sq mi),[3][4] according to the Philippines Statistical Authority and the WorldBank and, as of 2015, had a population of at least 100 million.[6] As of January 2018[update], it is the eighth-most populated country in Asia and the 12th most populated country in the world. Approximately 10 million additional Filipinos lived overseas,[21] comprising one of the world's largest diasporas. Multiple ethnicities and cultures are found throughout the islands. In prehistoric times, Negritos were some of the archipelago's earliest inhabitants. They were followed by successive waves of Austronesian peoples.[22] Exchanges with Malay, Indian, Arab and Chinese nations occurred. Then, various competing maritime states were established under the rule of datus, rajahs, sultans and lakans.


The arrival of Ferdinand Magellan, a Portuguese explorer leading a fleet for the Spanish, in Homonhon, Eastern Samar in 1521 marked the beginning of Hispanic colonization. In 1543, Spanish explorer Ruy López de Villalobos named the archipelago Las Islas Filipinas in honor of Philip II of Spain. With the arrival of Miguel López de Legazpi from Mexico City, in 1565, the first Hispanic settlement in the archipelago was established.[23] The Philippines became part of the Spanish Empire for more than 300 years. This resulted in Catholicism becoming the dominant religion. During this time, Manila became the western hub of the trans-Pacific trade connecting Asia with Acapulco in the Americas using Manila galleons.[24]

As the 19th century gave way to the 20th, the Philippine Revolution quickly followed, which then spawned the short-lived First Philippine Republic, followed by the bloody Philippine–American War.[25] The war, as well as the ensuing cholera epidemic, resulted in the deaths of thousands of combatants as well as tens of thousands of civilians.[26][27][28][29] Aside from the period of Japanese occupation, the United States retained sovereignty over the islands until after World War II, when the Philippines was recognized as an independent nation. Since then, the unitary sovereign state  has often had a tumultuous experience with democracy, which included the overthrow of a dictatorship by a non-violent revolution.[30]

The Philippines is a founding member of the United Nations, World Trade Organization, Association of Southeast Asian Nations, the Asia-Pacific Economic Cooperation forum, and the East Asia Summit. It also hosts the headquarters of the Asian Development Bank.[31] The Philippines is considered to be an emerging market and a newly industrialized country,[32] which has an economy transitioning from being based on agriculture to one based more on services and manufacturing.[33] Along with East Timor, the Philippines is one of Southeast Asia's predominantly Christian nations.


The Philippines was named in honor of King Philip II of Spain. Spanish explorer Ruy López de Villalobos, during his expedition in 1542, named the islands of Leyte and Samar Felipinas after the then-Prince of Asturias. Eventually the name Las Islas Filipinas would be used to cover all the islands of the archipelago. Before that became commonplace, other names such as Islas del Poniente (Islands of the West) and Magellan's name for the islands San Lázaro were also used by the Spanish to refer to the islands.[34][35][36][37][38]

The official name of the Philippines has changed several times in the course of its history. During the Philippine Revolution, the Malolos Congress proclaimed the establishment of the República Filipina or the Philippine Republic. From the period of the Spanish–American War (1898) and the Philippine–American War (1899–1902) until the Commonwealth period (1935–1946), American colonial authorities referred to the country as the Philippine Islands, a translation of the Spanish name.[25] Since the end of World War II, the official name of the country has been the Republic of the Philippines. Philippines has steadily gained currency as the common name since being the name used in Article VI of the 1898 Treaty of Paris, with or without the definite article.[39]

Discovery in 2018 of stone tools and fossils of butchered animal remains in Rizal, Kalinga has pushed back evidence of early hominins in the archipelago to as early as 709,000 years.[40] However, the metatarsal of the Callao Man, reliably dated by uranium-series dating to 67,000 years ago remains the oldest human remnant found in the archipelago to date.[41] This distinction previously belonged to the Tabon Man of Palawan, carbon-dated to around 26,500 years ago.[42][43]Negritos were also among the archipelago's earliest inhabitants, but their first settlement in the Philippines has not been reliably dated.[44]

There are several opposing theories regarding the origins of ancient Filipinos. F. Landa Jocano theorizes that the ancestors of the Filipinos evolved locally. Wilhelm Solheim's Island Origin Theory[45] postulates that the peopling of the archipelago transpired via trade networks originating in the Sundaland area around 48,000 to 5000 BC rather than by wide-scale migration. The Austronesian Expansion Theory explains that Malayo-Polynesians coming from Taiwan began migrating to the Philippines around 4000 BC, displacing earlier arrivals.[46]

The most widely accepted theory, based on linguistic and archeological evidence, is the ""Out-of-Taiwan"" model, which hypothesizes that Austronesians from Taiwan, who were themselves descended from the neolithic civilizations of the Yangtze river such as the Liangzhu culture,[47] began migrating to the Philippines around 4000 BC, displacing earlier arrivals.[46][48] During the neolithic period, a ""jade culture"" is said to have existed as evidenced by tens of thousands of exquisitely crafted jade artifacts found in the Philippines dated to 2000 BC.[49][50]

The jade is said to have originated nearby in Taiwan and is also found in many other areas in insular and mainland Southeast Asia. These artifacts are said to be evidence of long range communication between prehistoric Southeast Asian societies.[51] By 1000 BC, the inhabitants of the archipelago had developed into four kinds of social groups: hunter-gatherer tribes, warrior societies, highland plutocracies, and port principalities.[52]

The current demarcation between the Prehistory and the Early history of the Philippines is 21 April 900, which is the equivalent on the Proleptic Gregorian calendar for the date indicated on the Laguna Copperplate Inscription (LCI) — the earliest known surviving written record to come from the Philippines.[53] This date came in the middle of what anthropologists refer to as the Philippines' ""Emergent Phase"" (1st–14th centuries CE), which was characterized by newly emerging socio-cultural patterns, the initial development of large coastal settlements, greater social stratification and specialization, and the beginnings of local and international trade.[54] By the 1300s, a number of the large coastal settlements had become progressive trading centers, and became the focal point of societal changes, ushering complex lifeways which characterized what F. Landa Jocano called the ""Barangic Phase"" of early Philippine history, beginning from the 14th century through the arrival of Spanish colonizers and the beginning of the Philippines' colonial period.[54]

The discovery of iron at around the 1st century AD created significant social and economic changes which allowed settlements to grow larger and develop new social patterns, characterized by social stratification and specialization.[54]

Some of these polities, particularly the coastal settlements at or near the mouths of large rivers,[55] eventually developed substantial trade contacts with the early trading powers of Southeast Asia, most importantly the Indianized kingdoms of Malaysia and Java, the various dynasties of China,[55] Thailand,[56] and later, the Muslim Sultanate of Brunei.[57]  They also traded with Vietnam,[56] Japan,[58] and other Austronesian islands.[59]

Based on archeological findings, trade with China is believed to have begun in the Tang dynasty, but grew more extensive during the Song dynasty.[57] By the 2nd millennium CE, some (but not all) Philippine polities were known to have sent trade delegations which participated in the Tributary system enforced by the Chinese imperial court.[57]  These ""tributary states"" nominally acknowledged the Sinocentric system which saw China and the imperial court as the cultural center of the world.  Among the early Philippine polities, this arrangement fulfilled the requirements for trade with China, but did not actually translate into political or military control.[57][55]

Regarding the relations of early Philippine polities with the various state-level polities of Indonesia and Malaysia, legendary accounts often mention the interaction of early Philippine polities with the Srivijaya empire, but there is not much archeological evidence to definitively support such a relationship.[54] Considerable evidence exists, on the other hand, for extensive trade with the Majapahit empire.[60]

The exact scope and mechanisms of Indian cultural influences on early Philippine polities are still the subject of some debate among Southeast Asian historiographers,[54][61] but the current scholarly consensus is that there was probably little or no direct trade between India and the Philippines,[54][61] and Indian cultural traits, such as linguistic terms and religious practices,[60] filtered in during the 10th through the early 14th centuries, through early Philippine polities' relations with the Hindu Majapahit empire.[54] The Philippine archipelago is thus one of the countries, (others include Afghanistan and Southern Vietnam) just at the outer edge of what is considered the ""Greater Indian cultural zone"".[61]

The early polities of the Philippine archipelago were typically characterized by a three-tier social structure.[54][55] Although different cultures had different terms to describe them, this three-tier structure invariably consisted of an apex nobility class, a class of ""freemen"", and a class of dependent debtor-bondsmen called ""alipin"" or ""oripun.""[54][55]  Among the members of the nobility class were leaders who held the political office of ""Datu,"" which was responsible for leading autonomous social groups called ""barangay"" or ""dulohan"".[54]  Whenever these barangays banded together, either to form a larger settlement[54] or a geographically looser alliance group,[55] the more senior or respected among them would be recognized as a ""paramount datu"", variedly called a Lakan, Sultan, Rajah, or simply a more senior Datu.[57][54][62]

 The earliest historical record of local polities and kingdoms is the Laguna Copperplate Inscription, which indirectly refers to the Tagalog polity of Tondo (c. before 900–1589) and two to three other settlements believed to be located somewhere near Tondo, as well as a settlement near Mt. Diwata in Mindanao, and the temple complex of Medang in Java.[53] Although the precise political relationships between these polities is unclear in the text of the inscription, the artifact is usually accepted as evidence of intra- and inter-regional political linkages as early as 900 CE.[53][57][55]  By the arrival of the earliest European ethnographers during the 1500s, Tondo was led by the paramount ruler called a ""Lakan"".[57][55] It had grown into a major trading hub, sharing a monopoly with the Rajahnate of Maynila over the trade of Ming dynasty[63] products throughout the archipelago.[57]  This trade was significant enough that the Yongle Emperor appointed a Chinese governor named Ko Ch'a-lao to oversee it.[64][65]

The next historical record referring to a location in the Philippines, is Volume 186 of the official history of the Song dynasty which describes the purportedly Buddhist ""country"" of Ma-i (c. before 971 – after 1339). Song dynasty traders visited Ma-i annually, and their accounts described Ma-i's geography, trade products, and the trade behaviors of its rulers.[66] Chinese merchants noted that Ma-i's citizens were honest and trustworthy.[67] Because the descriptions of Mai's location in these accounts are unclear, there is dispute about Mai's location, with some scholars believing it was located in Bay, Laguna,[68] and others believing it was on the island of Mindoro.[69]

The official history of the Song dynasty next refers to the Rajahnate of Butuan (c. before 1001–1756) in northeastern Mindanao which is the first polity from the Philippine archipelago recorded as having sent a tribute mission to the Chinese empire—on March 17, 1001 CE. Butuan attained prominence under the rule of Rajah Sri Bata Shaja,[59] who was from a Buddhist ruling-class governing a Hindu nation. This state became powerful due to the local goldsmith industry and it also had commercial ties and a diplomatic rivalry with the Champa civilization. Butuan was so wealthy, the quantity of gold recently unearthed in Butuan surpassed that of the even more famous Srivijaya state even when most of the gold of the Butuan kingdom were already plundered by various invaders before modern times.[70]

Historian Efren Isorena has asserted that Visayan raiding parties conducted raids on the port cities of southern China between A.D. 1174 and 1190 which are attributed by other historians to raiders from Formosa (today's Taiwan).[71] The Visayan raiding parties were composed of people from the Kedatuan of Dapitan which was founded when Datu Sumangga of Leyte married princess Bugbung Hamusanum by impressing her through proving his military prowess by raiding and pillaging deep into the Chinese Empire. Their family then developed their territory into a powerful and wealthy maritime state, which was eventually deemed the ""Venice of the Visayas"".[72]

According to legend, the Kedatuan of Madja-as (c. 1200–1569) was founded following a civil war in collapsing Srivijaya, wherein loyalists of the Malay datus of Srivijaya defied the invading Chola dynasty and its puppet-Rajah, called Makatunao, and set up a remnant state in the islands of the Visayas. Its founding datu, Puti, had purchased land for his new realms from the aboriginal Ati hero, Marikudo.[73] Madja-as was founded on Panay island (named after the destroyed state of Pannai as well as populated by Pannai's descendants, a constituent state of Srivijaya which was located in Sumatra and was home to a Hindu-Buddhist Monastic-Army that successfully defended the Strait of Malacca,[74] the world's busiest maritime choke-point,[75] which was a significant challenge to defend due to it being surrounded by the three most populous nations of the world back then, China, India and Indonesia. The people of Pannai policed the Strait against all odds for 727 years.) Upon their rebellion against an invading Chola Empire, the people of Madja-as, being die-hard loyalists and warriors, conducted resistance movements against the Hindu and Islamic invaders that arrived from the west from their new home base in the Visayas islands.[76]

The Rajahnate of Cebu[77] (c. 1200–1565) was a neighbor of Madja-as in the Visayas led by Rajamuda Sri Lumay, a monarch with partial Tamil descent and a member of the Chola dynasty. Sri Lumay who sent by the Chola Maharajah to invade Madja-as, rebelled and formed his own independent Tamil-Malay rajahnate and even when descended from Maharajahs, humbled himself to be a mere founding Rajah of Cebu and had associated himself with the Visayans. This state grew wealthy by making use of the inter-island shipping within the archipelago.[78] Both the Rajahnates of Butuan and Cebu were allied to each other and they also maintained contact and had trade routes with Kutai, a Hindu country[79] in south Borneo established by Indian traders.[80]

The epic poem Nagarakretagama stated that the Java-based Hindu empire of Majapahit had colonized Saludong (Manila) at Luzon and Solot (Sulu) at the Sulu Archipelago. However, they failed to establish a foothold in the Visayas islands which was populated by Srivijayan loyalists who waged incessant guerrilla warfare against them. Eventually, Luzon regained independence from Majapahit after the Battle of Manila (1365) and then Sulu also reestablished independence and in vengeance, assaulted the Majapahit province of Poni (Brunei) before a fleet from the capital drove them out.[81] The Rajahnate of Maynila (c. 1258–1571) was established on the island of Luzon across the Pasig River from Tondo due to the naval victory of the Bruneian Rajah Ahmad over the Majapahit Rajah Avirjirkaya, who ruled a prior pre-Muslim settlement in the same location.[57]  The subsequent spread of Islam in Southeast Asia eventually caused the downfall of the Majapahit empire as its provinces seceded and formed independent Sultanates upon becoming Muslim. Eventually, in the face of these Islamic conversions, the remnants of Hindu Majapahit fled to the island of Bali.[82] The Chinese also mention a polity called ""Luzon."" This is believed to be a reference to Maynila since Portuguese and Spanish accounts from the 1520s explicitly state that  ""Luçon"" and ""Maynila"" were ""one and the same"",[57] although some historians argue that since none of these observers actually visited Maynila, ""Luçon"" may simply have referred to all the Tagalog and Kapampangan polities that rose up on the shores of Manila Bay.[83] Either way, from the early 1500s to as late as the 1560s, this seafaring people was referred to in Portuguese Malacca as Luções, and they set up many overseas communities across Southeast Asia where they participated in trading ventures and military campaigns in Burma, Malacca and Eastern Timor[84][85][86] as traders and mercenaries.[87][88][89] One prominent Luções was Regimo de Raja, who was a spice magnate and a Temenggung (Jawi: تمڠݢوڠ)[90] (Governor and Chief General) in Portuguese Malacca. He was also the head of an international armada which traded and protected commerce between the Indian Ocean, the Strait of Malacca, the South China Sea,[91] and the medieval maritime principalities of the Philippines.[92][93]

