"","country_names","country_urls","text"
"1","Brunei","https://en.wikipedia.org/wiki/Brunei","





Coordinates: 4°30′N 114°40′E﻿ / ﻿4.500°N 114.667°E﻿ / 4.500; 114.667


in ASEAN (dark grey)  –  [Legend]

Brunei (/bruːˈnaɪ/ (listen) broo-NY), officially the Nation of Brunei, the Abode of Peace[10] (Malay: Negara Brunei Darussalam, Jawi: .mw-parser-output .script-arabic,.mw-parser-output .script-Arab{font-family:Scheherazade,Lateef,LateefGR,Amiri,""Noto Naskh Arabic"",""Droid Arabic Naskh"",Harmattan,""Arabic Typesetting"",""Traditional Arabic"",""Simplified Arabic"",""Times New Roman"",Arial,""Sakkal Majalla"",""Microsoft Uighur"",Calibri,""Microsoft Sans Serif"",""Segoe UI"",serif,sans-serif;font-weight:normal}نڬارا بروني دارالسلام), is a country located on the north coast of the island of Borneo in Southeast Asia. Apart from its coastline with the South China Sea, the country is completely surrounded by the Malaysian state of Sarawak. It is separated into two parts by the Sarawak district of Limbang. Brunei is the only sovereign state completely on the island of Borneo; the remainder of the island's territory is divided between the nations of Malaysia and Indonesia. Brunei's population was 423,196 in 2016.[11]

At the peak of the Bruneian Empire, Sultan Bolkiah (reigned 1485–1528) is alleged to have had control over most regions of Borneo, including modern-day Sarawak and Sabah, as well as the Sulu Archipelago off the northeast tip of Borneo, Seludong (modern-day Manila), and the islands off the northwest tip of Borneo. The maritime state was visited by Spain's Magellan Expedition in 1521 and fought against Spain in the 1578 Castilian War.


During the 19th century, the Bruneian Empire began to decline. The Sultanate ceded Sarawak (Kuching) to James Brooke and installed him as the White Rajah, and it ceded Sabah to the British North Borneo Chartered Company. In 1888, Brunei became a British protectorate and was assigned a British resident as colonial manager in 1906. After the Japanese occupation during World War II, in 1959 a new constitution was written. In 1962, a small armed rebellion against the monarchy was ended with the help of the British.[12]

Brunei gained its independence from the United Kingdom on 1 January 1984. Economic growth during the 1990s and 2000s, with the GDP increasing 56% from 1999 to 2008, transformed Brunei into an industrialised country. It has developed wealth from extensive petroleum and natural gas fields. Brunei has the second-highest Human Development Index among the Southeast Asian nations, after Singapore, and is classified as a ""developed country"".[13] According to the International Monetary Fund (IMF), Brunei is ranked fifth in the world by gross domestic product per capita at purchasing power parity. The IMF estimated in 2011 that Brunei was one of two countries (the other being Libya) with a public debt at 0% of the national GDP. Forbes also ranks Brunei as the fifth-richest nation out of 182, based on its petroleum and natural gas fields.[14]

According to local historiography, Brunei was founded by Awang Alak Betatar, later to be Sultan Muhammad Shah, reigning around AD 1400. He moved from Garang in the Temburong District[15] to the Brunei River estuary, discovering Brunei. According to legend, upon landing he exclaimed, Baru nah (loosely translated as ""that's it!"" or ""there""), from which the name ""Brunei"" was derived.[16] He was the first Muslim ruler of Brunei.[17] Before the rise of the Bruneian Empire under the Muslim Bolkiah Dynasty, Brunei is believed to have been under Buddhist rulers.[18]

It was renamed ""Barunai"" in the 14th century, possibly influenced by the Sanskrit word ""varuṇ"" (वरुण), meaning ""seafarers"".[19] The word ""Borneo"" is of the same origin. In the country's full name, Negara Brunei Darussalam, darussalam (Arabic: دار السلام‎) means ""abode of peace"", while negara means ""country"" in Malay.


The earliest recorded documentation by the West about Brunei is by an Italian known as Ludovico di Varthema, who also said the ""Bruneian people have fairer skin tone than the peoples he met in Maluku Islands"". On his documentation back to 1550;


We arrived at the island of Bornei (Brunei or Borneo), which is distant from the Maluch about two hundred miles, and we found that it was somewhat larger than the aforesaid and much lower. The people are pagans and are men of goodwill. Their colour is whiter than that of the other sort ... in this island justice is well administered ...[20]

The settlement known as Vijayapura was a colony to the Buddhist Srivijaya empire and was thought to be located in Borneo's Northwest which flourished in the 7th Century.[21] In the aftermath of the Indian Chola invasion of Srivijaya, Datu Puti lead some dissident datus from Sumatra and Borneo in a rebellion against Rajah Makatunao who was a Chola appointed local Rajah. The dissidents and their retinue tried to revive Srivijaya in a new country called Madja-as in the Visayas islands (an archipelago named after Srivijaya) in the Philippines. One of the earliest Chinese records of an independent kingdom in Borneo is the 977 AD letter to Chinese emperor from the ruler of Po-ni, which some scholars believe to refer to Borneo.[22] In 1225, a Chinese official, Chau Ju-Kua (Zhao Rugua), reported that Po-ni had 100 warships to protect its trade, and that there was a lot of wealth in the kingdom.[23]

In the 14th century, the Javanese manuscript Nagarakretagama, written by Prapanca in 1365, mentioned Barune as the constituent state of Hindu Majapahit,[24] which had to make an annual tribute of 40 katis of camphor. In 1369, Sulu which was also formerly part of Majapahit, had successfully rebelled and then attacked Po-ni, looting it of treasure and gold. A fleet from Majapahit succeeded in driving away the Sulus, but Po-ni was left weaker after the attack.[25] A Chinese report from 1371 described Po-ni as poor and totally controlled by Majapahit.[26]

During the 15th century, Po-ni had seceded from Majapahit and then converted to Islam. Thus transforming into the independent Sultanate of Brunei. Brunei became a Hashemite state when she allowed the Arab Emir of Mecca, Sharif Ali, to become her third sultan. Scholars claim that the power of the Sultanate of Brunei was at its peak between the 15th and 17th centuries, with its power extending from northern Borneo to the southern Philippines (Sulu) and even in the northern Philippines (Manila) which Brunei incorporated via territorial acquisition accomplished through royal marriages.[27] Sultan Bolkiah had extended Brunei's power to it's greatest extent when it conquered Manila and Sulu as he even attempted but failed to conquer the Visayas islands even though Sultan Bolkiah was half-Visayan himself being descended from a Visayan mother and he was famously known as Sultan Ragam ""The Singing Captain"", his powerful musical voice was a trait he inherited from his Visayan lineage since Visayans were culturally obsessed with singing, with the best Visayan singers often also being members of their warrior castes too.[28] However, Islamic Brunei's power was not uncontested in Borneo since it had a Hindu rival in a state founded by Indians called Kutai in the south which they overpowered but didn't destroy. Brunei's dominance in the Philippines was also challenged by two Indianized kingdoms, the Rajahanates of Cebu and Butuan which were also coincidentally allied with Kutai and were also at war with Brunei's dependencies; Sulu and Manila as well as their mutual ally, the Sultanate of Maguindanao. The Kedatuans of Madja-as and Dapitan were also belligerent against Brunei due to them being the targets of constant Muslim attacks organized from Maguindanao and Ternate, a Papuan speaking state in the vicinity of Oceania that grew wealthy by monopolizing spice production. Nevertheless, by the 16th century, Islam was firmly rooted in Brunei, and the country had built one of its biggest mosques. In 1578, Alonso Beltrán, a Spanish traveller, described it as being five stories tall and built on the water.[29]

 Brunei briefly rose to prominence in Southeast Asia when the Portuguese occupied Malacca and thereby forced the wealthy and powerful but displaced Muslim refugees there to relocate to nearby Sultanates such as Aceh and Brunei. However, European influence gradually brought an end to the regional power, as Brunei entered a period of decline compounded by internal strife over royal succession. In the face of these invasions by European Christian powers, the Ottoman Caliphate aided the beleaguered Southeast Asian Sultanates by making Aceh a protectorate and sending expeditions to reinforce, train and equip the local mujahideen.[30] Eventually, the Spanish took advantage of the rivalries among the port-kingdoms of the Philippines and had incorporated some these kingdoms in a coalition against Brunei. Spain was still fresh from the Reconquista an 800 year old war to Re-Christianize a Spain which was invaded by the Umayyad Caliphate. So, their knowledge of, an admiration of, as well as a hatred of Islam was still fresh in their hearts when Spain and Portugal decided to wage war against the entire Islamic world. The Spanish regarded Brunei the center of Islamic preaching in the Philippines.[27] Spain declared war in 1578, planning to attack and capture Kota Batu, Brunei's capital at the time. This was based in part on the assistance of two Bruneian noblemen, Pengiran Seri Lela and Pengiran Seri Ratna. The former had travelled to Manila, then the centre of the Spanish colony. Manila itself was captured from Brunei, Christianised and made a territory of the Viceroyalty of New Spain which was centered in Mexico City. Pengiran Seri Lela came to offer Brunei as a tributary to Spain for help to recover the throne usurped by his brother, Saiful Rijal.[31] The Spanish agreed that if they succeeded in conquering Brunei, Pengiran Seri Lela would be appointed as the sultan, while Pengiran Seri Ratna would be the new Bendahara.


In March 1578, a fresh Spanish fleet had arrived from Mexico and settled at the Philippines, they were led by De Sande, acting as Capitán-General, he organised an expedition from Manila for Brunei. The expedition consisted of 400 Spaniards and Mexicans, 1,500 Filipino natives and 300 Borneans.[32] The campaign was one of many, which also included action in Mindanao and Sulu.[33][34] The racial make-up of the Christian side was diverse since it were usually made up of Mestizos, Mulattoes and Native Americans (Aztecs, Mayans and Incans) who were gathered and sent from Mexico and were led by Spanish officers who had worked together with native Filipinos in military campaigns across the Southeast Asia.[35] The Muslim side though was also equally racially diverse. In addition to the native Malay warriors, the Ottomans had repeatedly sent military expeditions to nearby Aceh. The expeditions were composed mainly of Turks, Egyptians, Swahilis, Somalis, Sindhis, Gujaratis and Malabars.[36] These expeditionary forces had also spread to other nearby Sultanates such as Brunei and had taught new fighting tactics and techniques on how to forge cannons.[37]

Eventually, the Spanish invaded the capital on 16 April 1578, with the help of Pengiran Seri Lela and Pengiran Seri Ratna. The Sultan Saiful Rijal and Paduka Seri Begawan Sultan Abdul Kahar were forced to flee to Meragang then to Jerudong. In Jerudong, they made plans to chase the conquering army away from Brunei. Suffering high fatalities due to a cholera or dysentery outbreak,[38][39] the Spanish decided to abandon Brunei and returned to Manila on 26 June 1578, after 72 days. Before doing so, they burned the mosque, a high structure with a five-tier roof.[40]

Pengiran Seri Lela died in August or September 1578, probably from the same illness suffered by his Spanish allies. There was suspicion that he the legitimate Sultan could have been poisoned by the ruling sultan. Seri Lela's daughter, a Bruneian princess, ""Putri"", had left with the Spanish, she abandoned her claim to the crown and bravely defied the Quranic punishment of stoning to death women who marry non-Muslims and then she married a Christian Tagalog, named Agustín de Legazpi de Tondo.[41]

The local Brunei accounts[42] differ greatly from the generally accepted view of events. What was called the Castilian War was seen as a heroic episode, with the Spaniards being driven out by Bendahara Sakam, purportedly a brother of the ruling sultan, and a thousand native warriors. Most historians consider this to be a folk-hero account, which probably developed decades or centuries after.[43]

Brunei eventually descended into anarchy. The country suffered a civil war from 1660 to 1673.


The British have intervened in the affairs of Brunei on several occasions. Britain attacked Brunei in July 1846 due to internal conflicts over who was the rightful Sultan.[44]

In the 1880s, the decline of the Bruneian Empire continued. The sultan granted land (now Sarawak) to James Brooke, who had helped him quell a rebellion and allowed him to establish the Kingdom of Sarawak. Over time, Brooke and his nephews (who succeeded him) leased or annexed more land. Brunei lost much of its territory to him and his dynasty, known as the White Rajahs.


Sultan Hashim Jalilul Alam Aqamaddin appealed to the British to stop further encroachment by the Brookes.[45] The ""Treaty of Protection"" was negotiated by Sir Hugh Low and signed into effect on 17 September 1888. The treaty said that the sultan ""could not cede or lease any territory to foreign powers without British consent""; it provided Britain effective control over Brunei's external affairs, making it a British protected state (which continued until 1984).[27] But, when the Kingdom of Sarawak annexed Brunei's Pandaruan District in 1890, the British did not take any action to stop it. They did not regard either Brunei or the Kingdom of Sarawak as 'foreign' (per the Treaty of Protection). This final annexation by Sarawak left Brunei with its current small land mass and separation into two parts.[46]

British residents were introduced in Brunei under the Supplementary Protectorate Agreement in 1906.[47] The residents were to advise the sultan on all matters of administration. Over time, the resident assumed more executive control than the sultan. The residential system ended in 1959.[48]

Petroleum was discovered in 1929 after several fruitless attempts.[49] Two men, F. F. Marriot and T. G. Cochrane, smelled oil near the Seria river in late 1926.[50] They informed a geophysicist, who conducted a survey there. In 1927, gas seepages were reported in the area. Seria Well Number One (S-1) was drilled on 12 July 1928. Oil was struck at 297 metres (974 ft) on 5 April 1929. Seria Well Number 2 was drilled on 19 August 1929, and, as of 2009[update], continues to produce oil.[51] Oil production was increased considerably in the 1930s with the development of more oil fields. In 1940, oil production was at more than six million barrels.[51] The British Malayan Petroleum Company (now Brunei Shell Petroleum Company) was formed on 22 July 1922.[52] The first offshore well was drilled in 1957.[53] Oil and natural gas have been the basis of Brunei's development and wealth since the late 20th century.


The Japanese invaded Brunei on 16 December 1941, eight days after their attack on Pearl Harbor and the United States Navy. They landed 10,000 troops of the Kawaguchi Detachment from Cam Ranh Bay at Kuala Belait. After six days' fighting, they occupied the entire country. The only Allied troops in the area were the 2nd Battalion of the 15th Punjab Regiment based at Kuching, Sarawak.[54]

Once the Japanese occupied Brunei, they made an agreement with Sultan Ahmad Tajuddin over governing the country. Inche Ibrahim (known later as Pehin Datu Perdana Menteri Dato Laila Utama Awang Haji Ibrahim), a former Secretary to the British Resident, Ernest Edgar Pengilly, was appointed Chief Administrative Officer under the Japanese Governor. The Japanese had proposed that Pengilly retain his position under their administration, but he declined. Both he and other British nationals still in Brunei were interned by the Japanese at Batu Lintang camp in Sarawak. While the British officials were under Japanese guard, Ibrahim made a point of personally shaking each one by the hand and wishing him well.[55]

The Sultan retained his throne and was given a pension and honours by the Japanese. During the later part of the occupation, he resided at Tantuya, Limbang and had little to do with the Japanese. Most of the Malay government officers were retained by the Japanese. Brunei's administration was reorganised into five prefectures, which included British North Borneo. The Prefectures included Baram, Labuan, Lawas, and Limbang. Ibrahim hid numerous significant government documents from the Japanese during the occupation. Pengiran Yusuf (later YAM Pengiran Setia Negara Pengiran Haji Mohd Yusuf), along with other Bruneians, was sent to Japan for training. Although in the area the day of the atomic bombing of Hiroshima, Yusuf survived.


The British had anticipated a Japanese attack, but lacked the resources to defend the area because of their engagement in the war in Europe. The troops from the Punjab Regiment filled in the Seria oilfield oilwells with concrete in September 1941 to deny the Japanese their use. The remaining equipment and installations were destroyed when the Japanese invaded Malaya. By the end of the war, 16 wells at Miri and Seria had been restarted, with production reaching about half the pre-war level. Coal production at Muara was also recommenced, but with little success.


During the occupation, the Japanese had their language taught in schools, and Government officers were required to learn Japanese. The local currency was replaced by what was to become known as duit pisang (banana money). From 1943 hyper-inflation destroyed the currency's value and, at the end of the war, this currency was worthless. Allied attacks on shipping eventually caused trade to cease. Food and medicine fell into short supply, and the population suffered famine and disease.


The airport runway was constructed by the Japanese during the occupation, and in 1943 Japanese naval units were based in Brunei Bay and Labuan. The naval base was destroyed by Allied bombing, but the airport runway survived. The facility was developed as a public airport. In 1944 the Allies began a bombing campaign against the occupying Japanese, which destroyed much of the town and Kuala Belait, but missed Kampong Ayer.[56]

On 10 June 1945, the Australian 9th Division landed at Muara under Operation Oboe Six to recapture Borneo from the Japanese. They were supported by American air and naval units. Brunei town was bombed extensively and recaptured after three days of heavy fighting. Many buildings were destroyed, including the Mosque. The Japanese forces in Brunei, Borneo, and Sarawak, under Lieutenant-General Masao Baba, formally surrendered at Labuan on 10 September 1945. The British Military Administration took over from the Japanese and remained until July 1946.


After World War II, a new government was formed in Brunei under the British Military Administration (BMA). It consisted mainly of Australian officers and servicemen.[57] The administration of Brunei was passed to the Civil Administration on 6 July 1945. The Brunei State Council was also revived that year.[58] The BMA was tasked to revive the Bruneian economy, which was extensively damaged by the Japanese during their occupation. They also had to put out the fires on the wells of Seria, which had been set by the Japanese prior to their defeat.[58]

Before 1941, the Governor of the Straits Settlements, based in Singapore, was responsible for the duties of British High Commissioner for Brunei, Sarawak, and North Borneo (now Sabah).[59] The first British High Commissioner for Brunei was the Governor of Sarawak, Sir Charles Ardon Clarke.
The Barisan Pemuda (""Youth Movement"") (abbreviated as BARIP) was the first political party to be formed in Brunei, on 12 April 1946. The party intended to ""preserve the sovereignty of the Sultan and the country, and to defend the rights of the Malays"".[60] BARIP also contributed to the composition of the country's national anthem. The party was dissolved in 1948 due to inactivity.


In 1959, a new constitution was written declaring Brunei a self-governing state, while its foreign affairs, security, and defence remained the responsibility of the United Kingdom.[61] A small rebellion erupted against the monarchy in 1962, which was suppressed with help of the UK. Known as the Brunei Revolt, it contributed to the failure to create the North Borneo Federation. The rebellion partially affected Brunei's decision to opt out of the Malaysian Federation.[61]

Brunei gained its independence from the United Kingdom on 1 January 1984.[61] The official National Day, which celebrates the country's independence, is held by tradition on 23 February.[62]

In July 1953, Sultan Omar Ali Saifuddien III formed a seven-member committee named Tujuh Serangkai, to find out the citizens' views regarding a written constitution for Brunei. In May 1954, the Sultan, Resident and High Commissioner met to discuss the findings of the committee. They agreed to authorise the drafting of a constitution. In March 1959 Sultan Omar Ali Saifuddien III led a delegation to London to discuss the proposed Constitution.[63] The British delegation was led by Sir Alan Lennox-Boyd, Secretary of State for the Colonies. The British Government later accepted the draft constitution.


On 29 September 1959, the Constitution Agreement was signed in Bandar Seri Begawan. The agreement was signed by Sultan Omar Ali Saifuddien III and Sir Robert Scott, the Commissioner-General for Southeast Asia.
It included the following provisions:[47]

Five councils were set up:[64]

A series of National Development Plans was initiated by the 28th Sultan of Brunei, Omar Ali Saifuddien III.


The first was introduced in 1953.[65] A total sum of B$100 million was approved by the Brunei State Council for the plan. E.R. Bevington, from the Colonial Office in Fiji, was appointed to implement it.[66] A $US14 million Gas Plant was built under the plan. In 1954, survey and exploration work were undertaken by the Brunei Shell Petroleum on both offshore and onshore fields. By 1956, production reached 114,700 bpd.


The plan also aided the development of public education. By 1958, expenditure on education totalled at $4 million.[66] Communications were improved, as new roads were built and reconstruction at Berakas Airport was completed in 1954.[67]

The second National Development Plan was launched in 1962.[67] A major oil and gas field was discovered in 1963, with this discovery, Liquefied Natural Gas became important. Developments in the oil and gas sector have continued, and oil production has steadily increased since then.[68] The plan also promoted the production of meat and eggs for consumption by citizens. The fishing industry increased its output by 25% throughout the course of the plan. The deepwater port at Muara was also constructed during this period. Power requirements were met, and studies were made to provide electricity to rural areas.[68] Efforts were made to eradicate malaria, an endemic disease in the region, with the help of the World Health Organization. Malaria cases were reduced from 300 cases in 1953 to only 66 cases in 1959.[69] The death rate was reduced from 20 per thousand in 1947 to 11.3 per thousand in 1953.[69] Infectious disease has been prevented by public sanitation and improvement of drainage, and the provision of piped pure water to the population.[69]

On 14 November 1971, Sultan Hassanal Bolkiah left for London to discuss matters regarding the amendments to the 1959 constitution. A new agreement was signed on 23 November 1971 with the British representative being Anthony Royle.[70]

Under this agreement, the following terms were agreed upon:


This agreement also caused Gurkha units to be deployed in Brunei, where they remain up to this day.


On 7 January 1979, another treaty was signed between Brunei and the United Kingdom. It was signed with Lord Goronwy-Roberts being the representative of the UK. This agreement granted Brunei to take over international responsibilities as an independent nation. Britain agreed to assist Brunei in diplomatic matters.[71] In May 1983, it was announced by the UK that the date of independence of Brunei would be 1 January 1984.[citation needed]

On 31 December 1983, a mass gathering was held on main mosques on all four of the districts of the country and at midnight, on 1 January 1984, the Proclamation of Independence was read by Sultan Hassanal Bolkiah. The sultan subsequently assumed the title ""His Majesty"", rather than the previous ""His Royal Highness"".[72] Brunei was admitted to the United Nations on 22 September 1984, becoming the organisation's 159th member.[73]

Relations with the Philippines which Brunei has been in a love-hate dynamic with due to the constant wars they waged against each other, in their territories; like when Arab led Malay-Bruneians destroyed Panay's Court of Nobles and in some time later, Spanish lead Latinos and Filipinos burned Brunei's Great Mosque, historically, was then symbolically patched up when Filipino Visayan architect Leandro V. Locsin, helped design and build the Istana Nurul Iman Palace, a name taken from Malay Istana and Arabic Nur-ol Imaan and means Palace of the Light of Faith which is now the largest residential Palace in the world.""[74]

