"","country_names","country_urls","text"
In the Lao language, the country's name is ""Muang Lao"" (ເມືອງລາວ) or ""Pathet Lao"" (ປະເທດລາວ), both literally mean ""Lao Country"".[20]

An ancient human skull was recovered from the Tam Pa Ling Cave in the Annamite Mountains in northern Laos; the skull is at least 46,000 years old, making it the oldest modern human fossil found to date in Southeast Asia.[21] Stone artifacts including Hoabinhian types have been found at sites dating to the Late Pleistocene in northern Laos.[22] Archaeological evidence suggests agriculturist society developed during the 4th millennium BC.[23] Burial jars and other kinds of sepulchers suggest a complex society in which bronze objects appeared around 1500 BC, and iron tools were known from 700 BC.[citation needed] The proto-historic period is characterised by contact with Chinese and Indian civilisations.[citation needed] According to linguistic and other historical evidence, Tai-speaking tribes migrated southwestward to the modern territories of Laos and Thailand from Guangxi sometime between the 8th–10th centuries.[24]

Laos traces its history to the kingdom of Lan Xang (Million Elephants), which was founded in the 14th century by a Lao prince Fa Ngum,[25]:223 who, with 10,000 Khmer troops, took over Vientiane.[citation needed] Ngum was descended from a long line of Lao kings that traced back to Khoun Boulom.[citation needed] He made Theravada Buddhism the state religion and Lan Xang prospered. Within 20 years of its formation, the kingdom expanded eastward to Champa and along the Annamite mountains in Vietnam.[citation needed] His ministers, unable to tolerate his ruthlessness, forced him into exile to the present-day Thai province of Nan in 1373,[26] where he died.[citation needed] Fa Ngum's eldest son, Oun Heuan, ascended to the throne under the name Samsenthai and reigned for 43 years.[citation needed] Lan Xang became an important trade centre during Samsenthai's reign, but after his death in 1421 it collapsed into warring factions for 100 years.[citation needed]

In 1520, Photisarath came to the throne and moved the capital from Luang Prabang to Vientiane to avoid a Burmese invasion.[citation needed]Setthathirat became king in 1548, after his father was killed, and ordered the construction of what became the symbol of Laos, That Luang.[citation needed] Setthathirat disappeared in the mountains on his way back from a military expedition into Cambodia and Lan Xang began to rapidly decline.[citation needed]

It was not until 1637, when Sourigna Vongsa ascended the throne, that Lan Xang further expanded its frontiers.[citation needed] His reign is often regarded as Laos's golden age.[citation needed] When he died without an heir, the kingdom split into three principalities.[citation needed] Between 1763 and 1769, Burmese armies overran northern Laos and annexed Luang Phrabang, while Champasak eventually came under Siamese suzerainty.[citation needed]

Chao Anouvong was installed as a vassal king of Vientiane by the Siamese. He encouraged a renaissance of Lao fine arts and literature and improved relations with Luang Phrabang.[citation needed] Under Vietnamese pressure, he rebelled against the Siamese in 1826.[citation needed] The rebellion failed and Vientiane was ransacked.[27] Anouvong was taken to Bangkok as a prisoner, where he died.[citation needed]

A Siamese military campaign in Laos in 1876 was described by a British observer as having been ""transformed into slave-hunting raids on a large scale"".[28]

In the late 19th century, Luang Prabang was ransacked by the Chinese Black Flag Army.[29] France rescued King Oun Kham and added Luang Phrabang to the Protectorate of French Indochina.[citation needed] Shortly after, the Kingdom of Champasak and the territory of Vientiane were added to the protectorate. King Sisavang Vong of Luang Phrabang became ruler of a unified Laos and Vientiane once again became the capital.[citation needed]

Laos never had any importance for France[30] other than as a buffer state between Thailand and the more economically important Annam and Tonkin.
During their rule, the French introduced the corvée, a system that forced every male Lao to contribute 10 days of manual labour per year to the colonial government.[citation needed] Laos produced tin, rubber, and coffee, but never accounted for more than one percent of French Indochina's exports. By 1940, around 600 French citizens lived in Laos.[31] Under the French rule, the Vietnamese were encouraged to migrate to Laos, which was seen by the French colonists as a rational solution to a practical problem within the confines of an Indochina-wide colonial space.[32] By 1943, the Vietnamese population stood at nearly 40,000, forming the majority in the largest cities of Laos and enjoying the right to elect their own leaders.[33] As a result, 53% of the population of Vientiane, 85% of Thakhek and 62% of Pakse were Vietnamese, with only an exception of Luang Phrabang where the population was predominantly Lao.[33] As late as 1945, the French even drew up an ambitious plan to move massive Vietnamese population to three key areas, i.e. the Vientiane Plain, Savannakhet region, Bolaven Plateau, which was only discarded by Japanese invasion of Indochina.[33] Otherwise, according to Martin Stuart-Fox, the Lao might well have lost control over their own country.[33]

During World War II in Laos, Vichy France, fascist Thailand, Imperial Japan and Free France occupied Laos.[citation needed] On 9 March 1945, a nationalist group declared Laos once more independent, with Luang Prabang as its capital but on 7 April 1945 two battalions of Japanese troops occupied the city.[34] The Japanese attempted to force Sisavang Vong (the King of Luang Phrabang) to declare Laotian independence but on 8 April he instead simply declared an end to Laos's status as a French protectorate.[citation needed] The King then secretly sent Prince Kindavong to represent Laos to the Allied forces and Prince Sisavang as representative to the Japanese.[34] When Japan surrendered, some Lao nationalists (including Prince Phetsarath) declared Laotian independence, but by early 1946, French troops had reoccupied the country and conferred limited autonomy on Laos.[citation needed]

During the First Indochina War, the Indochinese Communist Party formed the Pathet Lao independence organisation.[citation needed] The Pathet Lao began a war against the French Colonial forces with the aid of the Vietnamese independence organisation (the Viet Minh).[citation needed] In 1950 the French were forced to give Laos semi-autonomy as an ""associated state"" within the French Union.[citation needed] France remained in de facto control until 22 October 1953, when Laos gained full independence as a constitutional monarchy.[citation needed]

The First Indochina War took place across French Indochina and eventually led to French defeat and the signing of a peace accord for Laos at the Geneva Conference of 1954.[citation needed] In 1955, the US Department of Defense created a special Programs Evaluation Office to replace French support of the Royal Lao Army against the communist Pathet Lao as part of the US containment policy.[citation needed]

In 1960, amidst a series of rebellions in the Kingdom of Laos, fighting broke out between the Royal Lao Army and the communist North Vietnam-backed, and Soviet Union-backed Pathet Lao guerillas.[citation needed] A second Provisional Government of National Unity formed by Prince Souvanna Phouma in 1962 was unsuccessful, and the situation steadily deteriorated into large scale civil war between the Royal Laotian government and the Pathet Lao. The Pathet Lao were backed militarily by the NVA and Vietcong.[citation needed]

Laos was a key part of the Vietnam War since parts of Laos were invaded and occupied by North Vietnam for use as a supply route for its war against the South.[citation needed] In response, the United States initiated a bombing campaign against the North Vietnamese positions, supported regular and irregular anticommunist forces in Laos and supported South Vietnamese incursions into Laos.[citation needed]

In 1968 the North Vietnamese Army launched a multi-division attack to help the Pathet Lao to fight the Royal Lao Army.[citation needed] The attack resulted in the army largely demobilising, leaving the conflict to irregular ethnic Hmong forces of the ""U.S. Secret Army"" backed by the United States and Thailand, and led by General Vang Pao.[citation needed]

Massive aerial bombardment against the Pathet Lao and invading People's Army of Vietnam forces were carried out by the United States to prevent the collapse of the Royal Kingdom of Laos central government, and to deny the use of the Ho Chi Minh Trail to attack US forces in the Republic of Vietnam.[citation needed] Between 1964 and 1973, the U.S. dropped two million tons of bombs on Laos, nearly equal to the 2.1 million tons of bombs the U.S. dropped on Europe and Asia during all of World War II, making Laos the most heavily bombed country in history relative to the size of its population; The New York Times noted this was ""nearly a ton for every person in Laos"".[35] Some 80 million bombs failed to explode and remain scattered throughout the country, rendering vast swathes of land impossible to cultivate and killing or maiming 50 Laotians every year.[36] Due to the particularly heavy impact of cluster bombs during this war, Laos was a strong advocate of the Convention on Cluster Munitions to ban the weapons, and was host to the First Meeting of States Parties to the convention in November 2010.[37]

In 1975 the Pathet Lao, along with the Vietnam People's Army, and backed by the Soviet Union, overthrew the royalist Lao government, forcing King Savang Vatthana to abdicate on 2 December 1975.[citation needed] He later died in prison.[citation needed] Between 20,000 and 62,000 Laotians died during the Civil War.[38]

On 2 December 1975, after taking control of the country, the Pathet Lao government under Kaysone Phomvihane renamed the country as the Lao People's Democratic Republic and signed agreements giving Vietnam the right to station armed forces and to appoint advisers to assist in overseeing the country.[citation needed] In a paper published in 1990, Hmong-rights activist Vang Pobzeb wrote that Laos was colonial territory of Vietnam since 2 December 1975 and was directed by Vietnam in its internal and external affairs.[39] The close ties between Laos and Vietnam were formalized via a treaty signed in 1977, which has since provided not only directions for Lao foreign policy, but also the basis for Vietnamese involvement at all levels of Lao political and economic life.[40] Laos was requested in 1979 by the Socialist Republic of Vietnam to end relations with the People's Republic of China, leading to isolation in trade by China, the United States, and other countries.[41] In 1979 there were 50,000 Vietnamese troops stationed in Laos and as many as 6,000 civilian Vietnamese officials including 1,000 directly attached to the ministries in Vientiane.[42][43]

The conflict between Hmong rebels and the Vietnam People's Army of the Socialist Republic of Vietnam (SRV), as well as the SRV-backed Pathet Lao continued in key areas of Laos, including in Saysaboune Closed Military Zone, Xaisamboune Closed Military Zone near Vientiane Province and Xieng Khouang Province.[citation needed] From 1975 to 1996, the United States resettled some 250,000 Lao refugees from Thailand, including 130,000 Hmong[44] (see: Indochina refugee crisis).


On 2 December 2015, Laos celebrated its 40th anniversary of the establishment of the republic.[45]

Laos is the only landlocked country in Southeast Asia, and it lies mostly between latitudes 14° and 23°N (a small area is south of 14°), and longitudes 100° and 108°E. Its thickly forested landscape consists mostly of rugged mountains, the highest of which is Phou Bia at 2,818 metres (9,245 ft), with some plains and plateaus.[citation needed] The Mekong River forms a large part of the western boundary with Thailand, where the mountains of the Annamite Range form most of the eastern border with Vietnam and the Luang Prabang Range the northwestern border with the Thai highlands.[citation needed] There are two plateau, the Xiangkhoang in the north and the Bolaven Plateau at the southern end.[citation needed] The climate is tropical and influenced by the monsoon pattern.[46]

There is a distinct rainy season from May to November, followed by a dry season from December to April.[citation needed] Local tradition holds that there are three seasons (rainy, cold and hot) as the latter two months of the climatologically defined dry season are noticeably hotter than the earlier four months.[citation needed] The capital and largest city of Laos is Vientiane and other major cities include Luang Prabang, Savannakhet, and Pakse.[citation needed]

In 1993 the Laos government set aside 21 percent of the nation's land area for habitat conservation preservation.[47] The country is one of four in the opium poppy growing region known as the ""Golden Triangle""[48]. According to the October 2007 UNODC fact book Opium Poppy Cultivation in South East Asia, the poppy cultivation area was 15 square kilometres (5.8 sq mi), down from 18 square kilometres (6.9 sq mi) in 2006.[citation needed]

Laos can be considered to consist of three geographical areas: north, central, and south.[49]

Laos has a mostly tropical savanna climate. A tropical monsoon and humid sub-tropical climate also occurs in places.[citation needed] Laos is vulnerable to climate change and almost all provinces in the country are ""at high risk from climate change.""[50]

Laos is divided into 17 provinces (khoueng) and one prefecture (kampheng nakhon), which includes the capital city Vientiane (Nakhon Louang Viangchan).[citation needed] The new province, Xaisomboun Province, was established on 13 December 2013.[citation needed]
Provinces are further divided into districts (muang) and then villages (ban).[citation needed] An ""urban"" village is essentially a town.[49]

The Lao People's Democratic Republic is one of the world's only socialist states openly endorsing communism.[citation needed] The only legal political party is the Lao People's Revolutionary Party (LPRP).[51] The head of state is President Bounnhang Vorachith, also General Secretary of the Lao People's Revolutionary Party.[citation needed]

The head of government is Prime Minister Thongloun Sisoulith, who is also a member of the Lao People's Revolutionary Party's Politburo.[citation needed] Government policies are determined by the party through the all-powerful eleven-member Politburo of the Lao People's Revolutionary Party and the 61-member Central Committee of the Lao People's Revolutionary Party.[citation needed] Important government decisions are vetted by the Council of Ministers.[citation needed]The Socialist Republic of Vietnam maintains significant influence over the Politburo of Laos and the one-party communist state apparatus and military.[needs update][39]

Laos's first, French-written and monarchical constitution was promulgated on 11 May 1947, and declared Laos an independent state within the French Union.[citation needed] The revised constitution of 11 May 1957 omitted reference to the French Union, though close educational, health and technical ties with the former colonial power persisted.[citation needed] The 1957 document was abrogated on 3 December 1975, when a communist People's Republic was proclaimed.[citation needed] A new constitution was adopted in 1991 and enshrined a ""leading role"" for the LPRP.[citation needed] In 1990, deputy minister for science & technology Thongsouk Saysangkhi resigned from the government and party, calling for political reform.[citation needed] He died in captivity in 1998.[52]

In 1992 elections were held for a new 85-seat National Assembly with members, nominated by the one-party communist government, elected by secret ballot to five-year terms.[citation needed] The elections were widely disputed and questioned by Lao and Hmong opposition and dissident groups abroad and in Laos and Thailand.[citation needed] This National Assembly, which essentially acts as a rubber stamp for the LPRP, approves all new laws, although the executive branch retains authority to issue binding decrees.[citation needed] The most recent elections took place in April 2011.[citation needed] The assembly was expanded to 99 members in 1997, to 115 members in 2006 and finally to 132 members during the 2011 elections.[citation needed]

On 17 May 2014 the Defense Minister, who was also Deputy Prime Minister, Major General Douangchay Phichit, with other top ranking officials was killed in a plane crash in the north of the country.[citation needed] The officials were to participate in a ceremony to mark the liberation of the Plain of Jars from the former Royal Lao government forces.[53] Their Russian-built Antonov AN 74–300 with 20 people on board crashed in Xiengkhouang province.[54]

Some Hmong groups fought as CIA-backed units on the royalist side in the Laotian Civil War.[citation needed] After the Pathet Lao took over the country in 1975, the conflict continued in isolated pockets.[citation needed] In 1977, a communist newspaper promised the party would hunt down the ""American collaborators"" and their families ""to the last root"".[55]

As many as 200,000 Hmong went into exile in Thailand, with many ending up in the US.[citation needed] A number of Hmong fighters hid out in mountains in Xiangkhouang Province for many years, with a remnant emerging from the jungle in 2003.[55]

In 1989, the United Nations High Commissioner for Refugees (UNHCR), with the support of the US government, instituted the Comprehensive Plan of Action, a programme to stem the tide of Indochinese refugees from Laos, Vietnam, and Cambodia.[citation needed] Under the plan, refugee status was evaluated through a screening process.[citation needed] Recognized asylum seekers were given resettlement opportunities, while the remaining refugees were to be repatriated under guarantee of safety.[citation needed]

After talks with the UNHCR and the Thai government, Laos agreed to repatriate the 60,000 Lao refugees living in Thailand, including several thousand Hmong people.[citation needed] Very few of the Lao refugees, however, were willing to return voluntarily.[56] Pressure to resettle the refugees grew as the Thai government worked to close its remaining refugee camps.[citation needed] While some Hmong people returned to Laos voluntarily, with development assistance from UNHCR, allegations of forced repatriation surfaced.[57] Of those Hmong who did return to Laos, some quickly escaped back to Thailand, describing discrimination and brutal treatment at the hands of Lao authorities.[58]

In 1993, Vue Mai, a former Hmong soldier and leader of the largest Hmong refugee camp in Thailand, who had been recruited by the US Embassy in Bangkok to return to Laos as proof of the repatriation programme's success, disappeared in Vientiane.[citation needed] According to the US Committee for Refugees, he was arrested by Lao security forces and was never seen again.[59]

Following the Vue Mai incident, debate over the Hmong's planned repatriation to Laos intensified greatly, especially in the United States, where it drew strong opposition from many American conservatives and some human rights advocates.[citation needed] In a 23 October 1995 National Review article, Michael Johns, the former Heritage Foundation foreign policy expert and Republican White House aide, labelled the Hmong's repatriation a Clinton administration ""betrayal"", describing the Hmong as a people ""who have spilled their blood in defense of American geopolitical interests"".[60] Debate on the issue escalated quickly.[citation needed] In an effort to halt the planned repatriation, the Republican-led US Senate and House of Representatives both appropriated funds for the remaining Thailand-based Hmong to be immediately resettled in the United States; Clinton, however, responded by promising a veto of the legislation.[citation needed]

In their opposition of the repatriation plans, Democratic and Republican Members of Congress challenged the Clinton administration's position that the government of Laos was not systematically violating Hmong human rights.[citation needed] US Representative Steve Gunderson (R-WI), for instance, told a Hmong gathering: ""I do not enjoy standing up and saying to my government that you are not telling the truth, but if that is necessary to defend truth and justice, I will do that.""[60] Republicans called several Congressional hearings on alleged persecution of the Hmong in Laos in an apparent attempt to generate further support for their opposition to the Hmong's repatriation to Laos.[citation needed] Democratic Congressman Bruce Vento, Senator Paul Wellstone, Dana Rohrabacher and others also raised concerns.[citation needed]

Although some accusations of forced repatriation were denied,[61] thousands of Hmong people refused to return to Laos.[citation needed] In 1996 as the deadline for the closure of Thai refugee camps approached, and under mounting political pressure, the United States agreed to resettle Hmong refugees who passed a new screening process.[62] Around 5,000 Hmong people who were not resettled at the time of the camp closures sought asylum at Wat Tham Krabok, a Buddhist monastery in central Thailand where more than 10,000 Hmong refugees had already been living.[citation needed] The Thai government attempted to repatriate these refugees, but the Wat Tham Krabok Hmong refused to leave and the Lao government refused to accept them, claiming they were involved in the illegal drug trade and were of non-Lao origin.[63]

Following threats of forcible removal by the Thai government, the United States, in a significant victory for the Hmong, agreed to accept 15,000 of the refugees in 2003.[64] Several thousand Hmong people, fearing forced repatriation to Laos if they were not accepted for resettlement in the United States, fled the camp to live elsewhere within Thailand where a sizeable Hmong population has been present since the 19th century.[65]

In 2004 and 2005, thousands of Hmong fled from the jungles of Laos to a temporary refugee camp in the Thai province of Phetchabun.[66] These Hmong refugees, many of whom are descendants of the former-CIA Secret Army and their relatives, claim that they have been attacked by both the Lao and Vietnamese military forces operating inside Laos as recently as June 2006.[citation needed] The refugees claim that attacks against them have continued almost unabated since the war officially ended in 1975, and have become more intense in recent years.[citation needed]

Lending further support to earlier claims that the government of Laos was persecuting the Hmong, filmmaker Rebecca Sommer documented first-hand accounts in her documentary, Hunted Like Animals,[67] and in a comprehensive report that includes summaries of refugee claims and was submitted to the UN in May 2006.[68]

The European Union,[69] UNHCHR, and international groups have since spoken out about the forced repatriation.[69][70][71][72] The Thai foreign ministry has said that it will halt deportation of Hmong refugees held in Detention Centres in Nong Khai, while talks are underway to resettle them in Australia, Canada, the Netherlands and the United States.[73]

For the time being, countries willing to resettle the refugees are hindered in their immigration and settlement procedures because the Thai administration does not grant them access to the refugees.[citation needed] Plans to resettle additional Hmong refugees in the United States have been complicated by provisions of President George W. Bush's Patriot Act and Real ID Act, under which Hmong veterans of the Secret War, who fought on the side of the United States, are classified as terrorists because of their historical involvement in armed conflict.[citation needed]

On 27 December 2009, The New York Times reported that the Thai military was preparing to forcibly return 4,000 Hmong asylum seekers to Laos by the end of the year.[74] The BBC later reported that repatriations had started.[75] Both United States and United Nations officials have protested this action.[citation needed] Outside government representatives have not been allowed to interview this group over the last three years.[citation needed]Médecins Sans Frontières has refused to assist the Hmong refugees because of what they have called ""increasingly restrictive measures"" taken by the Thai military.[76] The Thai military jammed all cellular phone reception and disallowed any foreign journalists from the Hmong camps.[75]

Human rights violations remain a significant concern in Laos.[citation needed] Prominent civil society advocates, human rights defenders, political and religious dissidents, and Hmong refugees have disappeared at the hands of Lao military and security forces.[77]

